	Our Comment	Dialogue Context	Dialogue Situation	Response	Evidence Page Title 1	Evidence Paragraph First Sentence 1	Evidence Page Title 2	Evidence Paragraph First Sentence 2	Evidence Page Title 3	Evidence Paragraph First Sentence 3	Evidence Page Title 4	Evidence Paragraph First Sentence 4
0	It should be straightforward to find the answer to be "three-color method".	User: Who invented photography? Agent: Nic\u00e9phore Ni\u00e9pce, Henry Fox Talbot and Louis Daguerre are the inventors. User: When did color photography arrise? Agent: Do you want to know the time it was first attempted or the foundation method was proposed or the first photograph was made? User: Actually, what is the foundation method?	noAnswerNoRelevantInfo	Sorry, I didn't find any information defining the foundation method as it relates to color photography.								
1		User: Which country does Halloween originate from? Agent: I didn't find specific countries, but Halloween is thought to have roots in Christian beliefs and practices. User: What are some types of food eaten during Halloween?	clarification	Foods like candy apples, barmbrack, Bonfire toffee and various sweets and candy are associated with Halloween. Were you looking for Halloween foods from a particular area, like North America, Great Britain, Ireland or somewhere else?	Halloween	Because in the Northern Hemisphere Halloween comes in the wake of the yearly apple harvest, candy apples (known as toffee apples outside North America), caramel apples or taffy apples are common Halloween treats made by rolling whole apples in a sticky sugar syrup, sometimes followed by rolling them in nuts.	Halloween	One custom that persists in modern-day Ireland is the baking (or more often nowadays, the purchase) of a barmbrack (Irish: báirín breac), which is a light fruitcake, into which a plain ring, a coin, and other charms are placed before baking.	Halloween	List of foods associated with Halloween:		
2	Your evidence paragraphs do not contain information about China, Japan. You should either remove them or add corresponding evidence. In addition, the second paragraph is not used in your response. Remove it.	User: What kind of food goes in hotpots?	clarification	Hotpots contain a broth that is used to cook a variety of meats, seafood, tofu and vegetables. There are many national and regional variations, would you like information from a specific country like China, Japan, the UK or somewhere else?	Hot pot	Typical hot pot ingredients include thinly sliced meat, leaf vegetables, mushrooms, vermicelli, sliced potatoes, bean products, egg dumplings, tofu, and seafood.	Hot pot	Common ingredients	Lancashire hotpot	Lancashire hotpot is a stew originating from Lancashire in the North West of England. It consists of lamb or mutton and onion, topped with sliced potatoes (or a more traditional topping of pastry or puff pastry) and baked in a heavy pot on a low heat	Hot pot	Hot pot is a flavorful broth traditionally served inside a large metal pot. The broth is brought to a boil and left simmering for the duration of the meal.
3	You should specify the methane emission options in your response. Otherwise, you should remove those evidence paragraphs.	User: What is the main cause of contemporary climate change? Agent: It is caused by the emission of greenhouse gases, mostly carbon dioxide (CO2) and methane. Are you looking for the sources of such greenhouse gases? User: I'm curious to know where methane can be found?	clarification	Methane, on Earth, can be found below ground, under the sea floor and in the atmosphere. Were you looking for information about Methane on Earth or did you want information about Methane on other planets, like Mars?	Methane	Naturally occurring methane is found both below ground and under the seafloor and is formed by both geological and biological processes.	Methane on Mars	Since 2004, trace amounts of methane (range from 60 ppbv to under detection limit (< 0.05 ppbv)) have been reported in various missions and observational studies.	Greenhouse gas emissions	Electricity generation and transport are major emitters, the largest single source being coal-fired power stations with 20% of GHG.	Wetland methane emissions	Contributing approximately 167 Tg of methane to the atmosphere per year;[1] wetlands are the largest natural source of atmospheric methane in the world, and therefore remain a major area of concern with respect to climate change.
4		User: How did the Great Depression end in the United States?	directAnswer	The Great Depression in the United States ended in 1941 with the boom caused by American defense spending in anticipation of entering World War II.	Great Depression in the United States	By the end of 1941, before American entry into the war, defense spending and military mobilization had started one of the greatest booms in American history thus ending the last traces of unemployment.	Great Depression	The common view among economic historians is that the Great Depression ended with the advent of World War II.				
5		User: Are there any camping grounds or lodging possibilities in the Glacier National Park?	clarification	There are two Glacier National Parks. Would you like information on Glacier National Park in Canada or Glacier National Park in the United States?	Glacier National Park (U.S.)	Glacier National Park (U.S.)	Glacier National Park (Canada)	Glacier National Park (Canada)				
6		User: How do Ethiopians make Areki? Agent: Areki is a home distilled spirit that is often filtered through charcoal to remove off tastes or flavored by smoking or infusion with garlic. User: What do Ethiopians eat for breakfast?	directAnswer	Common Ethipian breakfast dishes include Chechebsa, ful and Fit-fit.	Ethiopian cuisine	Fit-fit or fir-fir is a common breakfast dish.	Ethiopian cuisine	Chechebsa (or kita firfir) resembles a pancake covered with berbere and niter kibbeh, or other spices, and may be eaten with a spoon.	Ethiopian cuisine	A variation of ful, a fava bean stew with condiments, served with baked rolls instead of injera, is also common for breakfast.		
7		User: How does the WHO decide what constitutes an epidemic and what constitutes a pandemic?	noAnswerButRelevantInfo	In February 2020, a WHO spokesperson clarified that "there is no official category [for a pandemic]".	Pandemic	The World Health Organization (WHO) previously applied a six-stage classification to describe the process by which a novel influenza virus moves from the first few infections in humans through to a pandemic.						
8		User: How are nations around the globe combatting climate change? Agent: Are you interested to know specifically about policies being used, international climate agreements, national responses or scientific consensus and society? User: Sorry, but none of them sounds interesting to me.	invalidDialogueContext									
9		User: What species are overfished in the Great Barrier Reef? Agent: Giant Triton and sharks are overfished. User: What do people dump in the water?	clarification	There are different types of dumping that occurs in water. Did you want to know about deliberate dumping, accidental dumping, nuclear waste dumping or another type of dumping?	Marine pollution	Marine debris, also known as marine litter, is human-created waste that has deliberately or accidentally been released in a sea or ocean.	Discharge of radioactive water of the Fukushima Daiichi Nuclear Power Plant	Radioactive waste water has been discharged into the Pacific Ocean since the Fukushima Daiichi nuclear disaster, triggered by the 2011 Tōhoku earthquake and tsunami on 11 March 2011 in Japan.	Marine debris	Marine debris, also known as marine litter, is human-created waste that has deliberately or accidentally been released in a sea or ocean.		
10		User: Where is the Parinacota located? Agent: Parinacota lies on the western margin of the Altiplano in the Central Andes. In Chile, where most of the edifice is located, Parinacota lies in the commune of Putre, Arica y Parinacota Region, and in Bolivia in the Oruro Department of the Sajama Province. User: How was Parinacota discovered?	noAnswerNoRelevantInfo	Sorry, I did not find any useful information.								
11	It would be good if you mention India specifically in your response as well since you include its evidence paragraph. There is no info about  "Americas" in your evidence, therefore don't mention it in your response.	User: Did any specific country have a significantly less severe experience during the Great Depression?	clarification	Yes. some countries and regions of the world were less affected by the Great Depression, like China, Japan and Ireland. Were you interested in countries from a certain region like Asia, Europe, the Americas or somewhere else?	Great Depression	China was largely unaffected by the Depression, mainly by having stuck to the Silver standard.	Great Depression	How much India was affected has been hotly debated. Historians have argued that the Great Depression slowed long-term industrial development.	Great Depression	Frank Barry and Mary E. Daly have argued that:  Ireland was a largely agrarian economy, trading almost exclusively with the UK, at the time of the Great Depression. Beef and dairy products comprised the bulk of exports, and Ireland fared well relative to many other commodity producers, particularly in the early years of the depression.	Great Depression	The Great Depression did not strongly affect Japan.